{
  "schemaVersion": 1,
  "id": "com.example.gain",
  "name": "Gain",
  "version": "0.1.0",
  "vendor": "Example Audio",
  "description": "A simple gain effect.",
  "category": "utility",
  "license": "MIT",
  "entry": { "wasm": "module.wasm", "abi": "audiospan-c" },
  "audio": {
    "inputs": [{ "id": "in", "name": "Input", "channels": { "min": 1, "max": 2 } }],
    "outputs": [{ "id": "out", "name": "Output", "channels": { "min": 1, "max": 2 } }],
    "maxFramesPerProcess": 2048,
    "latencyFrames": 0
  },
  "parameters": [
    { "id": "gain", "name": "Gain", "type": "float", "unit": "linear", "min": 0.0, "max": 2.0, "default": 1.0, "step": 0.01, "display": { "style": "knob", "format": "linear", "precision": 2 } },
    { "id": "mode", "name": "Mode", "type": "enum", "default": 0, "options": [ { "value": 0, "label": "Clean" }, { "value": 1, "label": "Warm" } ] },
    { "id": "stages", "name": "Stages", "type": "integer", "min": 1, "max": 4, "default": 1 },
    { "id": "enabled", "name": "Enabled", "type": "boolean", "default": 1 }
  ],
  "outputs": [
    { "id": "level", "name": "Level", "min": 0, "max": 2, "display": { "format": "linear", "precision": 2 } }
  ],
  "capabilities": { "state": true, "presets": true, "customUI": false, "midiInput": false, "sidechain": false, "network": false, "filesystem": false },
  "resources": { "maxMemoryBytes": 16777216, "maxStateBytes": 1048576, "maxAssetBytes": 1048576 },
  "presets": [ { "id": "default", "name": "Default", "path": "presets/default.json" } ]
}
